{
  "$schema": "https://json-schema.org/draft/2020-12/schema",
  "$id": "https://agentmindcloud.dev/schemas/chatgpt-spawn/plugin-0.1.json",
  "title": "ChatGPT plugin package manifest",
  "type": "object",
  "additionalProperties": false,
  "required": ["name", "version", "description", "author", "interface"],
  "properties": {
    "id": { "type": "string", "minLength": 1 },
    "name": {
      "type": "string",
      "pattern": "^[a-z0-9]+(?:-[a-z0-9]+)*$",
      "maxLength": 64
    },
    "version": {
      "type": "string",
      "pattern": "^(0|[1-9][0-9]*)\\.(0|[1-9][0-9]*)\\.(0|[1-9][0-9]*)(?:-[0-9A-Za-z-]+(?:\\.[0-9A-Za-z-]+)*)?(?:\\+[0-9A-Za-z-]+(?:\\.[0-9A-Za-z-]+)*)?$"
    },
    "description": { "type": "string", "minLength": 8 },
    "author": {
      "type": "object",
      "additionalProperties": false,
      "required": ["name"],
      "properties": {
        "name": { "type": "string", "minLength": 1 },
        "email": { "type": "string", "format": "email" },
        "url": { "type": "string", "format": "uri", "pattern": "^https://" }
      }
    },
    "homepage": { "type": "string", "format": "uri", "pattern": "^https://" },
    "repository": { "type": "string", "format": "uri", "pattern": "^https://" },
    "license": { "type": "string", "minLength": 1 },
    "keywords": {
      "type": "array",
      "uniqueItems": true,
      "items": { "type": "string", "minLength": 1 }
    },
    "skills": { "const": "./skills/" },
    "apps": { "const": "./.app.json" },
    "mcpServers": {
      "oneOf": [
        { "const": "./.mcp.json" },
        { "type": "object", "minProperties": 1 }
      ]
    },
    "interface": {
      "type": "object",
      "additionalProperties": false,
      "required": [
        "displayName",
        "shortDescription",
        "longDescription",
        "developerName",
        "category",
        "capabilities"
      ],
      "anyOf": [
        { "required": ["defaultPrompt"] },
        { "required": ["default_prompt"] }
      ],
      "properties": {
        "displayName": { "type": "string", "minLength": 1 },
        "shortDescription": { "type": "string", "minLength": 1 },
        "longDescription": { "type": "string", "minLength": 1 },
        "developerName": { "type": "string", "minLength": 1 },
        "category": { "type": "string", "minLength": 1 },
        "capabilities": {
          "type": "array",
          "minItems": 1,
          "uniqueItems": true,
          "items": { "type": "string", "minLength": 1 }
        },
        "websiteURL": { "type": "string", "format": "uri", "pattern": "^https://" },
        "privacyPolicyURL": { "type": "string", "format": "uri", "pattern": "^https://" },
        "termsOfServiceURL": { "type": "string", "format": "uri", "pattern": "^https://" },
        "defaultPrompt": {
          "type": "array",
          "minItems": 1,
          "maxItems": 3,
          "items": { "type": "string", "minLength": 1, "maxLength": 128 }
        },
        "default_prompt": {
          "type": "array",
          "minItems": 1,
          "maxItems": 3,
          "items": { "type": "string", "minLength": 1, "maxLength": 128 }
        },
        "brandColor": { "type": "string", "pattern": "^#[0-9A-Fa-f]{6}$" },
        "composerIcon": { "$ref": "#/$defs/assetPath" },
        "logo": { "$ref": "#/$defs/assetPath" },
        "logoDark": { "$ref": "#/$defs/assetPath" },
        "screenshots": {
          "type": "array",
          "items": { "$ref": "#/$defs/assetPath" }
        }
      }
    }
  },
  "$defs": {
    "assetPath": {
      "type": "string",
      "pattern": "^\\./assets/(?!.*(?:^|/)\\.\\.(?:/|$)).+"
    }
  }
}
